{
  "_note": "DO NOT EDIT — System Map v2 generated by scripts/dump_system_map.py. 代码事实来自扫描器，治理事实来自 docs/system-map/declarations.json。",
  "counts": {
    "api_routers": 172,
    "celery_tasks": 73,
    "mobile_routes": 141,
    "model_files": 122,
    "safety_rules_total": 65,
    "service_files": 486,
    "specialists": 13,
    "twin_partitions": 15,
    "web_pages": 82
  },
  "coverage": {
    "api_boundaries": {
      "limitations": "首期登记稳定 API 边界，不枚举所有动态端点。",
      "source": "backend/app/api/main.py",
      "status": "declaration"
    },
    "celery_jobs": {
      "source": "backend/app/tasks/",
      "status": "complete"
    },
    "mobile_navigation": {
      "limitations": "只包含静态字面量跳转；变量跳转和通知深链不在内。",
      "source": "docs/_generated/mobile-nav-graph.json",
      "status": "partial"
    },
    "mobile_surfaces": {
      "source": "mobile/app/",
      "status": "complete"
    },
    "runtime_dependencies": {
      "limitations": "外部服务与关键数据资源由显式声明覆盖，运行时条件依赖可能不在内。",
      "source": "docs/system-map/declarations.json",
      "status": "partial"
    },
    "web_surfaces": {
      "source": "frontend/src/app/",
      "status": "complete"
    }
  },
  "entities": [
    {
      "coverage": "declaration",
      "id": "api.health-v1",
      "kind": "api",
      "name": "Health API v1",
      "source": {
        "path": "backend/app/api/main.py",
        "type": "declaration"
      }
    },
    {
      "coverage": "declaration",
      "id": "api.mcp",
      "kind": "api",
      "name": "Reva MCP Tools",
      "source": {
        "path": "mcp-server/server.py",
        "type": "declaration"
      }
    },
    {
      "coverage": "declaration",
      "data_classes": [
        "L1",
        "L2",
        "L3",
        "L4"
      ],
      "domain": "health-os",
      "id": "component.backend-api",
      "kind": "component",
      "lifecycle": "production",
      "name": "FastAPI Backend",
      "owner": "backend",
      "source": {
        "path": "backend/app/api/main.py",
        "type": "declaration"
      },
      "trust_boundary": "health-backend"
    },
    {
      "coverage": "declaration",
      "domain": "health-os",
      "id": "component.celery-beat",
      "kind": "component",
      "lifecycle": "production",
      "name": "Celery Beat",
      "owner": "backend",
      "source": {
        "path": "backend/app/celery_app.py",
        "type": "declaration"
      }
    },
    {
      "coverage": "declaration",
      "data_classes": [
        "L2",
        "L3",
        "L4"
      ],
      "domain": "health-os",
      "id": "component.celery-worker",
      "kind": "component",
      "lifecycle": "production",
      "name": "Celery Worker",
      "owner": "backend",
      "source": {
        "path": "backend/app/celery_app.py",
        "type": "declaration"
      },
      "trust_boundary": "health-backend"
    },
    {
      "coverage": "declaration",
      "data_classes": [
        "L1",
        "L2",
        "L3"
      ],
      "domain": "health-os",
      "id": "component.frontend",
      "kind": "component",
      "lifecycle": "production",
      "name": "Web Frontend",
      "owner": "web",
      "source": {
        "path": "frontend/src/app/",
        "type": "declaration"
      }
    },
    {
      "coverage": "declaration",
      "data_classes": [
        "L1",
        "L2",
        "L3"
      ],
      "domain": "health-os",
      "id": "component.mac",
      "kind": "component",
      "lifecycle": "production",
      "name": "Mac App",
      "owner": "mac",
      "source": {
        "path": "apps/mac/",
        "type": "declaration"
      }
    },
    {
      "coverage": "declaration",
      "data_classes": [
        "L1",
        "L2",
        "L3"
      ],
      "domain": "health-os",
      "id": "component.mcp-server",
      "kind": "component",
      "lifecycle": "production",
      "name": "MCP Server",
      "owner": "backend",
      "source": {
        "path": "mcp-server/server.py",
        "type": "declaration"
      }
    },
    {
      "coverage": "declaration",
      "data_classes": [
        "L1",
        "L2",
        "L3",
        "L4"
      ],
      "domain": "health-os",
      "id": "component.mobile",
      "kind": "component",
      "lifecycle": "production",
      "name": "Mobile App",
      "owner": "mobile",
      "source": {
        "path": "mobile/app/",
        "type": "declaration"
      },
      "trust_boundary": "user-device"
    },
    {
      "coverage": "declaration",
      "data_classes": [
        "L1",
        "L2",
        "L3"
      ],
      "domain": "health-os",
      "id": "component.watch",
      "kind": "component",
      "lifecycle": "production",
      "name": "Watch App",
      "owner": "watch",
      "source": {
        "path": "apps/watch/",
        "type": "declaration"
      },
      "trust_boundary": "user-device"
    },
    {
      "coverage": "complete",
      "id": "job.celery.adherence-watch.adherence-watch",
      "kind": "job",
      "name": "adherence_watch",
      "owner": "backend",
      "source": {
        "path": "backend/app/tasks/adherence_watch.py",
        "symbol": "adherence_watch",
        "type": "code"
      },
      "tags": [
        "celery"
      ]
    },
    {
      "coverage": "complete",
      "id": "job.celery.aigc-media.reconcile-aigc-media-jobs",
      "kind": "job",
      "name": "reconcile_aigc_media_jobs",
      "owner": "backend",
      "source": {
        "path": "backend/app/tasks/aigc_media.py",
        "symbol": "reconcile_aigc_media_jobs",
        "type": "code"
      },
      "tags": [
        "celery"
      ]
    },
    {
      "coverage": "complete",
      "id": "job.celery.calendar-tasks.sync-all-calendars",
      "kind": "job",
      "name": "sync_all_calendars",
      "owner": "backend",
      "source": {
        "path": "backend/app/tasks/calendar_tasks.py",
        "symbol": "sync_all_calendars",
        "type": "code"
      },
      "tags": [
        "celery"
      ]
    },
    {
      "coverage": "complete",
      "id": "job.celery.checkup-plan-materialize.materialize-checkup-plans",
      "kind": "job",
      "name": "materialize_checkup_plans",
      "owner": "backend",
      "source": {
        "path": "backend/app/tasks/checkup_plan_materialize.py",
        "symbol": "materialize_checkup_plans",
        "type": "code"
      },
      "tags": [
        "celery"
      ]
    },
    {
      "coverage": "complete",
      "id": "job.celery.contextual-heartbeat.contextual-heartbeat",
      "kind": "job",
      "name": "contextual_heartbeat",
      "owner": "backend",
      "source": {
        "path": "backend/app/tasks/contextual_heartbeat.py",
        "symbol": "contextual_heartbeat",
        "type": "code"
      },
      "tags": [
        "celery"
      ]
    },
    {
      "coverage": "complete",
      "id": "job.celery.course-review-materialize.materialize-course-reviews",
      "kind": "job",
      "name": "materialize_course_reviews",
      "owner": "backend",
      "source": {
        "path": "backend/app/tasks/course_review_materialize.py",
        "symbol": "materialize_course_reviews",
        "type": "code"
      },
      "tags": [
        "celery"
      ]
    },
    {
      "coverage": "complete",
      "id": "job.celery.data-integrity-scan.data-integrity-scan",
      "kind": "job",
      "name": "data_integrity_scan",
      "owner": "backend",
      "source": {
        "path": "backend/app/tasks/data_integrity_scan.py",
        "symbol": "data_integrity_scan",
        "type": "code"
      },
      "tags": [
        "celery"
      ]
    },
    {
      "coverage": "complete",
      "id": "job.celery.dream-cycle.run-dream-cycle",
      "kind": "job",
      "name": "run_dream_cycle",
      "owner": "backend",
      "source": {
        "path": "backend/app/tasks/dream_cycle.py",
        "symbol": "run_dream_cycle",
        "type": "code"
      },
      "tags": [
        "celery"
      ]
    },
    {
      "coverage": "complete",
      "id": "job.celery.episode-reflection.run-episode-reflection",
      "kind": "job",
      "name": "run_episode_reflection",
      "owner": "backend",
      "source": {
        "path": "backend/app/tasks/episode_reflection.py",
        "symbol": "run_episode_reflection",
        "type": "code"
      },
      "tags": [
        "celery"
      ]
    },
    {
      "coverage": "complete",
      "id": "job.celery.episode-scheduler.scan-episode-action-windows",
      "kind": "job",
      "name": "scan_episode_action_windows",
      "owner": "backend",
      "source": {
        "path": "backend/app/tasks/episode_scheduler.py",
        "symbol": "scan_episode_action_windows",
        "type": "code"
      },
      "tags": [
        "celery"
      ]
    },
    {
      "coverage": "complete",
      "id": "job.celery.eval-runner.run-orchestrator-eval-weekly",
      "kind": "job",
      "name": "run_orchestrator_eval_weekly",
      "owner": "backend",
      "source": {
        "path": "backend/app/tasks/eval_runner.py",
        "symbol": "run_orchestrator_eval_weekly",
        "type": "code"
      },
      "tags": [
        "celery"
      ]
    },
    {
      "coverage": "complete",
      "id": "job.celery.event-reminders.scan-event-reminders",
      "kind": "job",
      "name": "scan_event_reminders",
      "owner": "backend",
      "source": {
        "path": "backend/app/tasks/event_reminders.py",
        "symbol": "scan_event_reminders",
        "type": "code"
      },
      "tags": [
        "celery"
      ]
    },
    {
      "coverage": "complete",
      "id": "job.celery.garmin-sync.auto-analyze-workout",
      "kind": "job",
      "name": "auto_analyze_workout",
      "owner": "backend",
      "source": {
        "path": "backend/app/tasks/garmin_sync.py",
        "symbol": "auto_analyze_workout",
        "type": "code"
      },
      "tags": [
        "celery"
      ]
    },
    {
      "coverage": "complete",
      "id": "job.celery.garmin-sync.renew-garmin-sessions",